<?xml version="1.0" encoding="UTF-8"?>
<?xml-stylesheet type="text/xsl" href="style.xsl" ?>
<Company xmlns:xsi="http://www.w3.org/2001/XMLSchema-instance" xsi:noNamespaceSchemaLocation="employee_demo.xsd">
  <Employee Emp_ID ="101">
    <Emp-name>VIKASH</Emp-name>
    <Emp-age>32</Emp-age>
    <Emp-salary>70000</Emp-salary>
    <Emp-emailid>ABC@GMAIL.COM</Emp-emailid>
    <Emp-Phonenum>9076854321</Emp-Phonenum>
    <Emp-designation>MANAGER</Emp-designation>
  </Employee>
  <Employee Emp_ID="102">
    <Emp-name>VIMAL</Emp-name>
    <Emp-age>22</Emp-age>
    <Emp-salary>50000</Emp-salary>
    <Emp-emailid>XYZ@GMAIL.COM</Emp-emailid>
    <Emp-Phonenum>9076854391</Emp-Phonenum>
    <Emp-designation>SOFTWARE DEV</Emp-designation>
  </Employee>
  <Employee Emp_ID="103">
    <Emp-name>ANISH</Emp-name>
    <Emp-age>21</Emp-age>
    <Emp-salary>100000</Emp-salary>
    <Emp-emailid>WER@GMAIL.COM</Emp-emailid>
    <Emp-Phonenum>9076054321</Emp-Phonenum>
    <Emp-designation>DESIGNER</Emp-designation>
  </Employee>
  <Employee Emp_ID= "104">
    <Emp-name>SINCHAN</Emp-name>
    <Emp-age>42</Emp-age>
    <Emp-salary>78000</Emp-salary>
    <Emp-emailid>YCV@GMAIL.COM</Emp-emailid>
    <Emp-Phonenum>9076804321</Emp-Phonenum>
    <Emp-designation>TESTER</Emp-designation>
  </Employee>
</Company>
